{
  "$schema": "https://json-schema.org/draft/2020-12/schema",
  "$id": "urn:railxia:asp:evidence-bundle:1",
  "title": "Evidence bundle, bundle_version 1",
  "$comment": "Three rules are not expressible here and are checked in code instead: every attestation_ref names the id of an entry in attestations, a deployment value's byte length is measured in UTF-8 bytes, not the Unicode code points maxLength counts, and an observed_file_access value is at most 262144 bytes as compact JSON with non-ASCII escaped, as the bundle is written.",
  "type": "object",
  "required": [
    "bundle_version",
    "bundle_id",
    "host_id",
    "sandbox_name",
    "collected_at",
    "rule_pack_version",
    "inputs_attempted",
    "attributes"
  ],
  "additionalProperties": false,
  "properties": {
    "bundle_version": {
      "const": 1
    },
    "bundle_id": {
      "type": "string",
      "minLength": 1
    },
    "host_id": {
      "type": "string",
      "minLength": 1,
      "maxLength": 64,
      "pattern": "\\S"
    },
    "sandbox_name": {
      "type": "string",
      "minLength": 1,
      "maxLength": 255,
      "pattern": "\\S"
    },
    "collected_at": {
      "type": "string",
      "format": "date-time"
    },
    "rule_pack_version": {
      "type": "integer",
      "minimum": 1
    },
    "inputs_attempted": {
      "type": "object",
      "required": [
        "runtime",
        "image",
        "manifest",
        "repo"
      ],
      "additionalProperties": false,
      "properties": {
        "runtime": {
          "$ref": "#/$defs/source"
        },
        "image": {
          "$ref": "#/$defs/non_runtime_source"
        },
        "manifest": {
          "$ref": "#/$defs/non_runtime_source"
        },
        "repo": {
          "$ref": "#/$defs/non_runtime_source"
        }
      }
    },
    "attestations": {
      "type": "array",
      "items": {
        "$ref": "#/$defs/attestation"
      }
    },
    "attributes": {
      "type": "object",
      "properties": {
        "deployment": {
          "allOf": [
            {
              "$ref": "#/$defs/attribute"
            },
            {
              "if": {
                "properties": {
                  "status": {
                    "const": "ANSWERED"
                  }
                }
              },
              "then": {
                "properties": {
                  "value": {
                    "$ref": "#/$defs/deployment_value"
                  }
                }
              }
            }
          ]
        },
        "observed_file_access": {
          "allOf": [
            {
              "$ref": "#/$defs/attribute"
            },
            {
              "if": {
                "properties": {
                  "status": {
                    "enum": [
                      "ANSWERED",
                      "PARTIAL"
                    ]
                  }
                }
              },
              "then": {
                "properties": {
                  "value": {
                    "$ref": "#/$defs/file_access_value"
                  }
                }
              }
            }
          ]
        },
        "egress_containment": {
          "allOf": [
            {
              "$ref": "#/$defs/attribute"
            },
            {
              "if": {
                "properties": {
                  "status": {
                    "enum": [
                      "ANSWERED",
                      "PARTIAL"
                    ]
                  }
                }
              },
              "then": {
                "properties": {
                  "value": {
                    "$ref": "#/$defs/egress_containment_value"
                  }
                }
              }
            }
          ]
        }
      },
      "additionalProperties": {
        "$ref": "#/$defs/attribute"
      }
    }
  },
  "$defs": {
    "reason": {
      "enum": [
        "NO_SOURCE_ACCESS",
        "NOT_FIRST_PARTY",
        "SOURCE_OK_NOT_PRESENT",
        "UNKNOWN_HARNESS",
        "NOT_COLLECTED_BY_PACK",
        "PRIVATE_STORE",
        "CODE_CONSTRUCTED",
        "GATEWAY_MANAGED",
        "ORCHESTRATOR_MANAGED",
        "PROVIDER_HOSTED",
        "TEMPLATE_UNRESOLVED",
        "PARSE_FAILED",
        "SIZE_CAP_EXCEEDED"
      ]
    },
    "source": {
      "type": "object",
      "required": [
        "attempted"
      ],
      "additionalProperties": false,
      "properties": {
        "attempted": {
          "type": "boolean"
        },
        "reached": {
          "type": "boolean"
        },
        "reason": {
          "$ref": "#/$defs/reason"
        },
        "window_seconds": {
          "type": "integer",
          "minimum": 0
        }
      },
      "allOf": [
        {
          "if": {
            "properties": {
              "attempted": {
                "const": false
              }
            }
          },
          "then": {
            "required": [
              "reason"
            ]
          }
        },
        {
          "if": {
            "properties": {
              "attempted": {
                "const": true
              }
            }
          },
          "then": {
            "required": [
              "reached"
            ]
          }
        },
        {
          "if": {
            "required": [
              "reached"
            ],
            "properties": {
              "reached": {
                "const": false
              }
            }
          },
          "then": {
            "required": [
              "reason"
            ]
          }
        }
      ]
    },
    "deployment_value": {
      "type": "object",
      "minProperties": 1,
      "additionalProperties": false,
      "properties": {
        "RAIL_DEPLOYMENT": {
          "type": "string",
          "minLength": 1,
          "pattern": "\\S"
        },
        "RAIL_NAMESPACE": {
          "type": "string",
          "minLength": 1,
          "pattern": "\\S"
        },
        "com.docker.compose.project": {
          "type": "string",
          "minLength": 1,
          "pattern": "\\S"
        },
        "com.docker.compose.service": {
          "type": "string",
          "minLength": 1,
          "pattern": "\\S"
        }
      },
      "$comment": "Each value's UTF-8 byte length must also stay under 253 bytes — checked in code, not here (see the top-level $comment)."
    },
    "file_access_value": {
      "type": "array",
      "maxItems": 512,
      "items": {
        "type": "object",
        "required": [
          "path",
          "read",
          "write",
          "exec",
          "layer"
        ],
        "additionalProperties": false,
        "properties": {
          "path": {
            "type": "string",
            "minLength": 1,
            "maxLength": 1024
          },
          "read": {
            "type": "boolean"
          },
          "write": {
            "type": "boolean"
          },
          "exec": {
            "type": "boolean"
          },
          "layer": {
            "type": "boolean"
          }
        }
      },
      "$comment": "The files the sandbox opened, as the kernel saw them (observed_file_access): one entry per (path, layer), read/write/exec the union of every open. ANSWERED and PARTIAL carry this list; RailMon writes null for ABSENT and BLIND. The whole value must also stay under 262144 bytes as compact JSON — checked in code, not here (see the top-level $comment)."
    },
    "egress_containment_value": {
      "type": "object",
      "required": [
        "level",
        "contained",
        "enforcer",
        "observations",
        "via",
        "allow_list",
        "reasons"
      ],
      "additionalProperties": false,
      "properties": {
        "level": {
          "enum": [
            "allow_list_enforced",
            "no_network",
            "internal_network",
            "open",
            "host_network",
            "host_process"
          ]
        },
        "contained": {
          "type": "boolean"
        },
        "enforcer": {
          "enum": [
            "openshell",
            null
          ]
        },
        "observations": {
          "type": "object",
          "required": [
            "network_mode",
            "networks",
            "openshell_labels",
            "privileged",
            "runtime_socket_mounts"
          ],
          "additionalProperties": false,
          "properties": {
            "network_mode": {
              "$comment": "a string, or null for a host process",
              "maxLength": 256
            },
            "networks": {
              "type": "array",
              "maxItems": 64,
              "items": {
                "type": "object",
                "required": [
                  "name",
                  "internal",
                  "gateway_peers"
                ],
                "additionalProperties": false,
                "properties": {
                  "name": {
                    "type": "string",
                    "minLength": 1,
                    "maxLength": 256
                  },
                  "internal": {
                    "enum": [
                      true,
                      false,
                      null
                    ]
                  },
                  "gateway_peers": {
                    "type": "array",
                    "maxItems": 64,
                    "items": {
                      "type": "string",
                      "minLength": 1,
                      "maxLength": 256
                    }
                  }
                }
              }
            },
            "openshell_labels": {
              "type": "boolean"
            },
            "privileged": {
              "type": "boolean"
            },
            "runtime_socket_mounts": {
              "type": "array",
              "maxItems": 64,
              "items": {
                "type": "string",
                "minLength": 1,
                "maxLength": 1024
              }
            }
          }
        },
        "via": {
          "$comment": "container:<name> when the network namespace is another container's, else null",
          "maxLength": 300
        },
        "allow_list": {
          "const": null
        },
        "reasons": {
          "type": "array",
          "maxItems": 16,
          "items": {
            "type": "string",
            "minLength": 1,
            "maxLength": 4096
          }
        }
      },
      "$comment": "DR-207. Whether the agent can open a connection to any outside host itself, read from Docker's view of the container (egress_containment). contained is true exactly for the first three levels. allow_list is always null in this pack: an enforced allow-list whose contents are not readable from the host, not an empty one. ANSWERED and PARTIAL carry this object; PARTIAL is always level open. RailMon writes null for ABSENT, BLIND and FAILED."
    },
    "non_runtime_source": {
      "allOf": [
        {
          "$ref": "#/$defs/source"
        },
        {
          "not": {
            "required": [
              "window_seconds"
            ]
          }
        }
      ]
    },
    "attestation": {
      "type": "object",
      "required": [
        "id",
        "root",
        "claim",
        "subject",
        "verified_at",
        "verifier_version"
      ],
      "additionalProperties": false,
      "properties": {
        "id": {
          "type": "string",
          "minLength": 1
        },
        "root": {
          "type": "string"
        },
        "claim": {
          "type": "string"
        },
        "subject": {
          "type": "string"
        },
        "verified_at": {
          "type": "string",
          "format": "date-time"
        },
        "verifier_version": {
          "type": "string"
        }
      }
    },
    "attribute": {
      "type": "object",
      "required": [
        "value",
        "status",
        "tier"
      ],
      "additionalProperties": false,
      "properties": {
        "value": true,
        "status": {
          "enum": [
            "ANSWERED",
            "ABSENT",
            "TEMPLATED",
            "PARTIAL",
            "BLIND",
            "FAILED"
          ]
        },
        "reason": {
          "$ref": "#/$defs/reason"
        },
        "tier": {
          "enum": [
            "declared",
            "interrogated",
            "observed"
          ]
        },
        "authored_by": {
          "enum": [
            "subject",
            "platform",
            "external",
            "none"
          ]
        },
        "method": {
          "type": "string",
          "minLength": 1
        },
        "note": {
          "type": "string"
        },
        "attestation_ref": {
          "type": "string",
          "minLength": 1
        }
      },
      "allOf": [
        {
          "if": {
            "properties": {
              "status": {
                "const": "ABSENT"
              }
            }
          },
          "then": {
            "required": [
              "method"
            ]
          }
        },
        {
          "if": {
            "properties": {
              "status": {
                "enum": [
                  "BLIND",
                  "FAILED"
                ]
              }
            }
          },
          "then": {
            "required": [
              "reason"
            ]
          }
        },
        {
          "if": {
            "properties": {
              "status": {
                "const": "ANSWERED"
              }
            }
          },
          "then": {
            "not": {
              "required": [
                "reason"
              ]
            }
          }
        },
        {
          "if": {
            "properties": {
              "status": {
                "enum": [
                  "ANSWERED",
                  "PARTIAL",
                  "TEMPLATED"
                ]
              }
            }
          },
          "then": {
            "required": [
              "authored_by"
            ]
          },
          "else": {
            "not": {
              "required": [
                "authored_by"
              ]
            }
          }
        }
      ]
    }
  }
}
